@@,item,itemlabel,position,positionlabel,startdate,enddate,psid
->,Q67056921,Rogelio Eduardo Rivas Polanco,Q67056742,Ministerio de Justicia y Seguridad Pública,2019-06-01,2021-03-26->2021-04-23,Q67056921-f22c9f36-4ea4-c9e1-8e82-a96bde9e268f
->,Q56249753,Nelson Eduardo Fuentes Menjívar,Q56249714,Ministerio de Hacienda,2018-03-20->2018-04-20,2020-07-28,Q56249753-aab4fe11-4da7-1ed2-9597-297e26d63351
->,Q110165180,Mariemm Eunice Pleitez Quiñonez,Q110164211,Ministerio de Cultura,2020-07-30->2021-07-30,,Q110165180-018CB45F-38D5-4CA1-AEEE-F0C5A6140238
->,Q110164006,Héctor Gustavo Villatoro,Q67056742,Ministerio de Justicia y Seguridad Pública,2021-03-26->2021-04-23,,Q110164006-22D9A13B-4AB8-44B0-8DAA-006591A2988D
---,Q61022687,"Félix Ulloa, Jr.",Q7925044,Vice President of El Salvador,2019-06-01,,Q61022687-7e23207c-44ac-ab62-2418-58897f150837
---,Q17712353,Nayib Bukele,Q878151,President of El Salvador,2019-06-01,,Q17712353-11132b04-4ba4-cead-5d0c-1da0c780b282
